{
  "schema": "mg_guide_meeting_follow_up_card_v1",
  "card_state": "blocked",
  "run": {
    "run_id": "run_nw006_ambiguous_opportunity_001",
    "workflow": "meeting_follow_up_v1",
    "packet_status": "blocked",
    "created_at": "2026-08-12T18:12:00Z"
  },
  "meeting": {
    "meeting_id": "meeting_nw006_004",
    "occurred_at": "2026-08-12T17:42:00Z",
    "title": "Morgan Case - Discovery Meeting"
  },
  "framing": {
    "tone": "blocked",
    "headline": "Follow-up blocked",
    "body": "No CRM changes were made by this card.",
    "no_crm_changes_made": true
  },
  "policy_display": {
    "note_write": "blocked",
    "stage_write": "blocked",
    "reason_codes": [
      "AMBIGUOUS_OPPORTUNITY"
    ]
  },
  "ui_integrity": {
    "errors": [],
    "schema_validation_errors": [],
    "invariant_violations": []
  },
  "crm_display": {
    "resolution_status": "ambiguous",
    "match_basis": "email",
    "candidate_count": 2,
    "current_stage": null
  },
  "metadata": {
    "contact_id": "contact_demo_morgan_001",
    "opportunity_id": null
  },
  "learning": {
    "summary": "Multiple open opportunities prevent deterministic opportunity mapping.",
    "needs": [
      "opportunity disambiguation"
    ],
    "objections": [
      "do not attach call to wrong deal"
    ],
    "next_step_action": "Resolve target opportunity before writes",
    "next_step_owner": "Alex Rivera"
  },
  "intents_display": {
    "note": [],
    "stage": [],
    "note_execution_attempted": false,
    "stage_execution_attempted": false
  },
  "brief_display": {
    "headline": "Opportunity match blocked",
    "next_action": "Escalate offline to select opportunity",
    "crm_actions": [],
    "salesperson_attention_required": true
  },
  "controls": {
    "mutation_controls_enabled": false,
    "agent_rerun_enabled": false,
    "policy_reeval_enabled": false,
    "allowed_human_actions": [
      "escalate_offline"
    ]
  },
  "integrity": {
    "external_effects": 0,
    "source_schema": "meeting_follow_up_packet_v1",
    "mapper_id": "meeting_follow_up_card_mapper_v1"
  }
}
